{
  "$schema": "https://json-schema.org/draft/2020-12/schema",
  "$id": "https://mechdog.local/schema/mechdog_messages.schema.json",
  "title": "MechDog MQTT Envelope",
  "description": "모든 MechDog MQTT 메시지의 공통 스펙. 팀 전체가 이 파일을 기준으로 각자 언어에서 직접 파싱/검증한다.",
  "type": "object",
  "additionalProperties": false,
  "required": ["ver", "msg_id", "ts", "src", "session_id", "payload"],
  "properties": {
    "ver": { "type": "integer", "const": 1 },
    "msg_id": { "type": "string", "minLength": 1 },
    "ts": {
      "type": "string",
      "description": "ISO 8601 + 타임존 오프셋 필수 (예: 2026-09-02T12:00:00+09:00). 오프셋 없는 naive datetime은 거부.",
      "pattern": "^\\d{4}-\\d{2}-\\d{2}T\\d{2}:\\d{2}:\\d{2}(\\.\\d+)?(Z|[+-]\\d{2}:\\d{2})$"
    },
    "src": { "$ref": "#/$defs/Node" },
    "session_id": { "type": "string", "minLength": 1 },
    "payload": {
      "oneOf": [
        { "$ref": "#/$defs/VisionFacePayload" },
        { "$ref": "#/$defs/VisionPpePayload" },
        { "$ref": "#/$defs/GateSessionPayload" },
        { "$ref": "#/$defs/DialogResultPayload" },
        { "$ref": "#/$defs/EscortStatusPayload" },
        { "$ref": "#/$defs/AlertEventPayload" },
        { "$ref": "#/$defs/SystemHealthPayload" },
        { "$ref": "#/$defs/RobotCommandPayload" }
      ]
    }
  },
  "$defs": {
    "Node": {
      "type": "string",
      "enum": ["mechdog_a", "mechdog_b", "mechdog_c", "mechdog_d", "rpi", "pc", "db", "dashboard"]
    },
    "FaceResult": {
      "type": "string",
      "enum": ["authorized", "unauthorized", "undetermined"],
      "description": "unauthorized(미인가)와 undetermined(판정 불가)는 절대 합치지 않는다. 전자는 보안 대응(D 출동), 후자는 재촬영 유도로 후속 처리가 다르다."
    },
    "PpeResult": {
      "type": "string",
      "enum": ["pass", "fail", "undetermined"],
      "description": "FaceResult와 동일한 이유로 3값 유지."
    },
    "PpeItem": { "type": "string", "enum": ["helmet", "vest"] },
    "AlertLevel": { "type": "string", "enum": ["info", "warn", "critical"] },
    "RobotAction": { "type": "string", "enum": ["warning_start", "warning_clear"],
      "description": "경고 시작/해제. 실제 동작 문자열(CMD|2|1|6|$ 등)은 노드 내부 구현이라 스키마에 두지 않는다." },
    "AlertReason": {
      "type": "string",
      "enum": ["unauthorized", "no_helmet", "no_vest", "face_timeout", "escort_lost", "dialog_timeout", "dialog_failed"]
    },
    "EscortState": { "type": "string", "enum": ["idle", "moving", "paused", "arrived", "aborted"] },
    "NodeState": { "type": "string", "enum": ["booting", "ready", "busy", "error", "offline"] },
    "Destination": {
      "type": "string",
      "enum": [
        "reception",
        "meeting_room_1",
        "safety_training_room",
        "inbound_dock",
        "outbound_dock",
        "inspection_area",
        "elevator_hall",
        "exit_gate"
      ],
      "description": "에스코트 목적지. 물류센터(중소형 배송·보관) 기준으로 확정된 8종. MechDog은 계단·엘리베이터를 이용할 수 없으므로 1층 평탄 경로 목적지만 포함하며, 2층 이상 목적지는 elevator_hall로 대체 안내한다. 좌표·웨이포인트 측량은 최현수(C) 담당."
    },
    "Confidence": { "type": "number", "minimum": 0.0, "maximum": 1.0 },
    "Point": {
      "type": "object",
      "additionalProperties": false,
      "required": ["x", "y"],
      "properties": {
        "x": { "type": "number", "description": "미터(m) 단위" },
        "y": { "type": "number", "description": "미터(m) 단위" },
        "z": { "type": "number", "default": 0.0, "description": "미터(m) 단위" }
      }
    },
    "VisionFacePayload": {
      "type": "object",
      "additionalProperties": false,
      "required": ["msg_type", "visitor_id", "result", "confidence", "snapshot_path"],
      "properties": {
        "msg_type": { "const": "vision.face" },
        "visitor_id": { "type": "string" },
        "result": { "$ref": "#/$defs/FaceResult" },
        "confidence": { "$ref": "#/$defs/Confidence" },
        "similarity": {
          "anyOf": [{ "$ref": "#/$defs/Confidence" }, { "type": "null" }],
          "default": null
        },
        "person_id": {
          "type": ["string", "null"],
          "maxLength": 20,
          "default": null,
          "description": "일치한 등록 인원(persons.person_id). 미인가 · 판정불가면 null. 실명은 싣지 않는다 (2026-09-29 추가, 선택)"
        },
        "latency_ms": {
          "type": ["integer", "null"],
          "minimum": 0,
          "default": null,
          "description": "판정 소요 시간(ms) — access_decisions.latency_ms (2026-09-29 추가, 선택)"
        },
        "snapshot_path": { "type": "string" }
      }
    },
    "VisionPpePayload": {
      "type": "object",
      "additionalProperties": false,
      "required": ["msg_type", "visitor_id", "items", "overall", "confidence", "snapshot_path"],
      "properties": {
        "msg_type": { "const": "vision.ppe" },
        "visitor_id": { "type": "string" },
        "items": {
          "type": "object",
          "additionalProperties": false,
          "properties": {
            "helmet": { "$ref": "#/$defs/PpeResult" },
            "vest": { "$ref": "#/$defs/PpeResult" }
          }
        },
        "overall": { "$ref": "#/$defs/PpeResult" },
        "confidence": { "$ref": "#/$defs/Confidence" },
        "latency_ms": {
          "type": ["integer", "null"],
          "minimum": 0,
          "default": null,
          "description": "판정 소요 시간(ms) — access_decisions.latency_ms (2026-09-29 추가, 선택)"
        },
        "snapshot_path": { "type": "string" }
      }
    },
    "GateSessionPayload": {
      "description": "A -> B 세션 인계 메시지",
      "type": "object",
      "additionalProperties": false,
      "required": ["msg_type", "visitor_id", "face_result", "ppe_result", "handoff_to"],
      "properties": {
        "msg_type": { "const": "gate.session" },
        "visitor_id": { "type": "string" },
        "face_result": { "$ref": "#/$defs/FaceResult" },
        "ppe_result": { "$ref": "#/$defs/PpeResult" },
        "handoff_to": { "$ref": "#/$defs/Node" }
      }
    },
    "DialogResultPayload": {
      "type": "object",
      "additionalProperties": false,
      "required": ["msg_type", "destination", "purpose", "confidence"],
      "properties": {
        "msg_type": { "const": "dialog.result" },
        "destination": { "$ref": "#/$defs/Destination" },
        "purpose": { "type": "string" },
        "confidence": { "$ref": "#/$defs/Confidence" },
        "retry_count": { "type": "integer", "minimum": 0, "default": 0 }
      }
    },
    "EscortStatusPayload": {
      "type": "object",
      "additionalProperties": false,
      "required": ["msg_type", "state", "destination", "position", "heading_deg", "distance_to_target_m"],
      "properties": {
        "msg_type": { "const": "escort.status" },
        "state": { "$ref": "#/$defs/EscortState" },
        "destination": { "$ref": "#/$defs/Destination" },
        "position": { "$ref": "#/$defs/Point" },
        "heading_deg": { "type": "number", "minimum": 0.0, "maximum": 360.0, "description": "도(degree) 단위" },
        "distance_to_target_m": { "type": "number", "minimum": 0.0, "description": "미터(m) 단위" }
      }
    },
    "AlertEventPayload": {
      "type": "object",
      "additionalProperties": false,
      "required": ["msg_type", "level", "reason"],
      "properties": {
        "msg_type": { "const": "alert.event" },
        "level": { "$ref": "#/$defs/AlertLevel" },
        "reason": { "$ref": "#/$defs/AlertReason" },
        "track_id": { "type": ["string", "null"], "default": null },
        "snapshot_path": { "type": ["string", "null"], "default": null },
        "resolved": { "type": "boolean", "default": false }
      }
    },
    "SystemHealthPayload": {
      "type": "object",
      "additionalProperties": false,
      "required": ["msg_type", "node", "state"],
      "properties": {
        "msg_type": { "const": "system.health" },
        "node": { "$ref": "#/$defs/Node" },
        "state": { "$ref": "#/$defs/NodeState" },
        "detail": { "type": ["string", "null"], "default": null }
      }
    }
    ,
    "RobotCommandPayload": {
      "type": "object",
      "additionalProperties": false,
      "required": ["msg_type", "dst", "action"],
      "properties": {
        "msg_type": { "const": "robot.command" },
        "dst": { "$ref": "#/$defs/Node", "description": "명령을 받을 노드. 봉투는 6필드 고정이라 여기에 둔다." },
        "action": { "$ref": "#/$defs/RobotAction" },
        "reason": { "$ref": "#/$defs/AlertReason", "description": "어떤 경고 때문인지 (선택)" }
      }
    }
  }
}
